<?xml version="1.0" encoding="UTF-8" standalone="no"?><biblioteca xmlns:xsi="http://www.w3.org/2001/XMLSchema-instance" xsi:noNamespaceSchemaLocation="bibliotecaMusicale.xsd"><musicista cognome="Verdi" genereMusicale="Opera" nome="Giuseppe"><album><titoloAlbum>Aida</titoloAlbum><annoPubblicazione>1840</annoPubblicazione></album></musicista><musicista cognome="Pallino" genereMusicale="Rap" nome="Pinco" nomeArte="ElPanco"><album><titoloAlbum>In the ghetto</titoloAlbum><annoPubblicazione>2013</annoPubblicazione><listaBrani><brano><titoloBrano>Homies forever</titoloBrano><lunghezzaBrano>4:23</lunghezzaBrano></brano></listaBrani></album><album><titoloAlbum>Brotherhood</titoloAlbum><annoPubblicazione>2015</annoPubblicazione><listaBrani><brano><titoloBrano>Run for your lives</titoloBrano><lunghezzaBrano>2:12</lunghezzaBrano></brano><brano><titoloBrano>Survivors</titoloBrano><lunghezzaBrano>3:15</lunghezzaBrano></brano></listaBrani></album><album><titoloAlbum>RapDeity</titoloAlbum><annoPubblicazione>2017</annoPubblicazione></album></musicista></biblioteca>